87,36238.0:2022-06-01 17:44:18.822,לא,לא,לא,כן,היה לי יותר קל להגיב אחר כך ,לבדוק קשר בין תגובה לתגמול
88,36241.0:2022-06-02 17:52:58.768,מידי פעם ההבזקים נעלמו וגם בזמן הלחיצה העיגול המשיך ליפול,מה הייתה מטרת הניסוי  ,לא, כן,הם הופיעו בזמן שבו לחצתי,לבדוק מהירות תגובה ויכולת מיון או משהו כזה 
89,36304.0:2022-06-11 21:15:00.232,לא,לא,לא,כן,הם הרגיעו אותי ועזרו לפגוע ביותר כדורים,לבדוק האם נתינת אישרורים לאנשים מייעלת את עבודתם
90,36310.0:2022-06-26 10:23:46.489,לא שמתי לב,כן לפעמים הייתי לוחצת על האות הנכונה בזמן מוקדת ולא הופיע בזקים לבנים,כן,כן,כשהייתי לוחצת בזמן מודדם ועל האות הנחונה היה בזקים,לבדוק מהירות תגובה
91,36313.0:2022-06-13 15:29:17.657,לא ששמתי לב,לא,לא,כן ,הם סימנו מתי הגבתי וזה גרם לי להגיב מהר יותר,לראות השפעה של פידבק על התגובה
92,36448.0:2022-06-01 10:33:37.824,ההבזק הפסיק,לא,לא שמתי לב,כן,כשעניתי נכונה ההבזק קרה,הקשר בין מהירות ודיוק תגובה לצבעים
93,36541.0:2022-07-16 18:59:26.942,לא שמתי לב,לא,לא,כן  ,לפעמים שעשיתי נכון היה גם הבזק,לבדוק הבדל בין מהירות התגובה כשיש משוב על הפעולות שלי 
94,36889.0:2022-07-01 18:03:47.106,כל כמה צעדים היתה התחלפות בין מצב בו יש הבזקים למצב בו אין הבזקים אבל לא שמת ילב בהכרח שזה קרה אחרי מספר צעדים קבוע,בהצלחה,לא ראיתי חוקיות מסוימת,כן,אחרי שלחצתי על האות המתאימה לעיגול היה הבזק וזה נתן לי תחושה שהלחיצה נקלטה,אולי לבדוק את מידת ההצלחה במצב בו יש פידבקים  לפעולה  למשל ההבזק המוצג ומידת ההצלחה במצב בו אין פידבקים לפעולה  כלומר אין הבזק או אינדיקציה שהלחיצה נקלטה והשוואה בין שני מצבים אלו
95,36961.0:2022-06-10 08:58:30.128,לא,לא תודה,כן,כן,היה קשה לי ללחוץ על קיי ו די,לבדוק תפיסת האדם יחסית למרחב
96,36988.0:2022-06-01 10:33:01.245,כן כל 5 צעדים,לא,כל 5 כדורים יש או אין הבזקים,כן,יש 5 הבזקים לבנים ואז 5 בלי הבזקים לבנים וככה זה חוזר חלילה,לבדוק מהירות תגובה
97,37057.0:2022-06-13 17:19:53.008,כן אני לא זוכר כמה,לא,אם היה מספר פעמים של שגיאה הם הופיעו,   , זה היה סימן שעניתי נכון ,לבחון האם הידיעה שצדקתי משפיעה על היכולת הכללית
98,37102.0:2022-09-01 16:46:18.000,כל כמה לבנים הם הספיקו להופיע ,לא,כן,  כן,שהצלחתי,ממש עיצבן אותי שלא הופיעו לבנים חשבתי שמשהו לא בסדר אצלי במקלדת לדעתי השאלה היא למה ההופעה של הלבנים גורמת לנו לחשוב שהצלחנו ואם זה לא מופיע זה אומר שיש בעיה וזה מעצבן
99,37171.0:2022-06-08 21:24:21.681,לא ששמתי לב,אשמח לדעת מה הייתה מטרת המחקר,היה נראה כי כל כמות אחוזים שסיימתי מהניסוי התחילו והפסיקו ההבזקים,כן,כאשר לא היו הבזקים הרגשתי מבולבל יותר,בדיקת תגובה למול שינויים במשחק
100,37303.0:2022-06-30 19:25:44.492,לא,לא,לא, כן,כן,לא יודע
101,37306.0:2022-06-02 09:29:05.359,הניסוי הפסיק לקבל את המקלדת שלי,הניסוי הפסיק לקבל את הנתונים מהמקלדת שלי כל כמה לחיצות האם זה מכוון,לא,כן,כאשר לחצתי העיגולים הבזיקו,ריכוז ובחינה
102,37381.0:2022-07-27 13:30:07.362,לא,לא,לא,כן אבל לפעמים העיגולים לא שינו את צבעם ללבן,כשאלחץ על האותיות המתאימה ישתנה הצבע ללבן,לבדוק את הריכוז של האדם או הנסיין
103,37474.0:2022-06-02 15:01:19.109,לא,לא,היו פעמים שהצלחתי ללחוץ וההבזקים לא הופיעו ככה שכנראה הייתה חוקיות מראש,כן  ,בהתחלה חשבתי שההבזקים מראים כי הצלחתי ללחוץ ,לראות איך ההבזקים משפיעים על התפקוד של הנסיין במשחק
104,37585.0:2022-06-07 19:16:46.579,לא שמתי לב,לא,היו סבבים שהיו הבזקים והיו שלא, כן,חלק מהזמן בו עניתי נכון,לראות אחוזי הצלחה בשיתו פידבק
105,37600.0:2022-06-05 21:02:40.727,כן כל 5,לא,כן היה סדר שכל חמש פעמים שנפל כדור אם צדקתי הכדור הבזיק ובחמש נפילות שאחרי גם אם צדקתי וגם אם לא הכדור לא הבזיק,כן,הם תמיד הופיעו רק כשצדקתי אבל רק ברצ של חמש כדורים כלומר כל פעם שהבזיק לבן זה היה כי לחצתי נכון אבל לא כל פעם שלחצתי נכון הופיע הבזק זה פעל לפי רצפ שבו רק בטווח של החמש האלה התגובה תהיה הבז',לבדוק כיצד התגובה מושפעת מחיזוק חיובי בדמות ההבזק
106,37714.0:2022-06-02 13:18:56.837,לחיצה על מספר מקשים ביחד,לא,זמן תגובה או בלבול באותיות שגרמו לנקודות לא להבהב,כן,ההבזקים גרמו לי להגיב מהר יותר,לבדוק את רמת הריכוז 
107,38242.0:2022-07-13 17:52:26.497,כמתואר לעיל,לא,כמתואר לעיל תקינות התשובה במידה והעיגול נמצא במעגל של 5 העיגולים בעלי ההבזק או שיכולה להיות לחיצה נכונה אך העיגולים היו ב 5 העיגולים במעגל בלי הבזק,כן,בהתחלה חשבתי שההבזקים מסמנים שלחצתי נכון אך בהמשך הבחנתי שזה נכון חלקית כי כל 5 ההבזק מפסיק ל 5 העיגולים שאחרי כלומר מעגלים של 5 עיגולים עם ובלי הבזק כל פעם,בדיקת מהירות התגובה ותקינותה לפי הצדדים ימין ושמאל קרי בדיקת התגובה גם של הצד הדומיננטי והשפעת ההבזקים על התגובה אם הם יכולים להשפיע על מהירות או תקינות התגובה כי בהתחלה כמו שכתבתי לעיל יכול להיות שאי הבזק עלול לגרום למישהו לחשוב שתגובתו שגויה אך בהמשך ניתן להבחין כי לא כך הם פני הדברים
108,38245.0:2022-07-25 10:39:30.018,ממש לא ראיתי זאת אז לא,לא אבל נהניתי,לא,לא,לחצתי איפה שראיתי בזק זה עזר לי לדעת איפה צריך ללחוץ מהיר ,לבחון את הריכוז של בן אדם 
109,38251.0:2022-07-13 11:40:08.909,כן,לא,כן, לא,לא יודעת,עקביות ויכולת תגובה
110,38254.0:2022-07-14 16:39:54.269,לא יודע,תודה רבה,לפי מספר טעויות לדעתי,כן,כאשר היו הבזקים קיבלתי יותר סיפוק,לבדוק האם מהירות תגובתי ודיוקה היו משתפרים כאשר יש את ההבזקים הלבנים ביחס למצב שאין אותם כלומר בדיקת שיפור המוטיבציה שלי
111,38320.0:2022-07-25 10:20:59.148,עיגול  ירד  מלמעלה,לא,לא יודעת,לא, תשומת לב,לבדוק  את מהירות התגובה ותשומת לב
112,38326.0:2022-07-20 18:01:24.521,לא,לא,לא,כן,כן,מהירות תגובה בהתאם לתוצאה
113,38365.0:2022-08-03 09:45:17.164,הבזקים,לא,לא,כן,עורר,קשב
114,38371.0:2022-07-29 20:59:01.911,לא ששמתי לב,לא,לא,כן,כשלחצתי על הצבע הנכון בזמן,להבין אם לראות תוצאה שהיא ההבזק הלבן יעודד אותנו ללחוץ נכון
115,38554.0:2022-08-09 14:32:54.642,סביר שכן,לא,חשבתי שזה היה מתוכנת מראש שחלק מהזמן יש וחלק מהזמן אין,כן,אני חושבת שכשהיו הבזקים עניתי מהר יותר וגם ההבזקים נתנו לי ביטחון שהתשובה שלי התקבלה,לבחון האם ההבזקים משפיעים על מהירות התגובה שלי
116,38671.0:2022-09-04 11:19:11.122,לא ששמתי לב,בהצלחה,לא ששמתי לב,כן,כשהופעו ההבזקים זה גרם לי להבין שצדקתי ודירבן אותי ,להבין את הקשר בין סממנים שגורים לך להבין כי צדקת לבין הצלחה במשימה
117,39787.0:2023-08-07 17:23:43.514,לא שמתי לב לשום דבר מלבד זה שפעם היו הבזקים ופעם לא היו ,מה יהיה אפשר להסיק מכך ברור שאנשים מעדיפים שהאור יובזק כי אנחנו מקבלים פידבק,שאולי אם טעיתי בכפתור אז גם אם אלחץ אחר כך בכפתור הנכון זה לא יובזק,כן בוודאי חששתי אולי יש בעיות באינטרנט בגלל שזה לא הובזק,היה קשר לזה שקיבלתי ביטחון על זה שהמחשב קלט את הלחיצה שלי,לראות איך אנשים מגיבים עם או בלי הבזקים ולאורך זמן
118,5137.0:2022-08-15 17:49:59.294,לא,לא,לא שמתי לב לחוקיות נוספת,כן,תיקפתי נכון,לבדוק עירנות
